{
  "brandId": "BRAND-KINGSTON",
  "schemaVersion": "1.0.0",
  "slug": "kingston",
  "displayName": "Kingston",
  "legalName": "Kingston Technology Company, Inc.",
  "country": "United States",
  "website": "https://www.kingston.com/",
  "manufacturerType": "HARDWARE_MANUFACTURER",
  "status": "ACTIVE",
  "aliases": [
    "Kingston Technology",
    "Kingston Technology Corp."
  ],
  "supportedCategories": [
    "CAT-RAM"
  ],
  "provenance": {
    "sourceUrl": "https://www.kingston.com/en/company",
    "retrievedAt": "2026-09-01T00:00:00Z",
    "verifiedBy": "Mirabelle Labs",
    "verificationStatus": "VERIFIED"
  },
  "metadata": {
    "createdAt": "2026-09-01T00:00:00Z",
    "updatedAt": "2026-09-01T00:00:00Z"
  }
}
