{
  "brandId": "BRAND-CORSAIR",
  "schemaVersion": "1.0.0",
  "slug": "corsair",
  "displayName": "Corsair",
  "legalName": "Corsair Gaming, Inc.",
  "country": "United States",
  "website": "https://www.corsair.com/",
  "manufacturerType": "HARDWARE_MANUFACTURER",
  "status": "ACTIVE",
  "aliases": [],
  "supportedCategories": [],
  "provenance": {
    "sourceUrl": "https://www.corsair.com/",
    "retrievedAt": "2026-07-25T00:00:00Z",
    "verifiedBy": "Mirabelle Labs",
    "verificationStatus": "VERIFIED"
  },
  "metadata": {
    "createdAt": "2026-07-25T00:00:00Z",
    "updatedAt": "2026-07-25T00:00:00Z"
  }
}
