{
  "brandId": "BRAND-XPG",
  "schemaVersion": "1.0.0",
  "slug": "xpg",
  "displayName": "XPG",
  "legalName": "ADATA Technology Co., Ltd.",
  "country": "Taiwan",
  "website": "https://www.adata.com/",
  "manufacturerType": "HARDWARE_MANUFACTURER",
  "status": "ACTIVE",
  "aliases": [],
  "supportedCategories": [
    "CAT-RAM"
  ],
  "provenance": {
    "sourceUrl": "https://www.adata.com/",
    "retrievedAt": "2026-10-04T00:00:00Z",
    "verifiedBy": "system:atlas-ram-coverage-expansion-batch-a-p1",
    "verificationStatus": "VERIFIED"
  },
  "metadata": {
    "createdAt": "2026-10-04T00:00:00Z",
    "updatedAt": "2026-10-04T00:00:00Z"
  }
}
