{
  "brandId": "BRAND-GSKILL",
  "schemaVersion": "1.0.0",
  "slug": "gskill",
  "displayName": "G.SKILL",
  "legalName": "G.SKILL International Enterprise Co., Ltd.",
  "country": "Taiwan",
  "website": "https://www.gskill.com/",
  "manufacturerType": "HARDWARE_MANUFACTURER",
  "status": "ACTIVE",
  "aliases": [],
  "supportedCategories": [
    "CAT-RAM"
  ],
  "provenance": {
    "sourceUrl": "https://www.gskill.com/about",
    "retrievedAt": "2026-09-01T00:00:00Z",
    "verifiedBy": "Mirabelle Labs",
    "verificationStatus": "VERIFIED"
  },
  "metadata": {
    "createdAt": "2026-09-01T00:00:00Z",
    "updatedAt": "2026-09-01T00:00:00Z"
  }
}
